{
  "$schema": "http://json-schema.org/draft-07/schema#",
  "$id": "https://home-search.internal/events/EmailSuppressed/v1",
  "title": "EmailSuppressed v1",
  "type": "object",
  "additionalProperties": false,
  "required": ["eventId", "eventType", "schemaVersion", "occurredAt", "producer", "aggregateType", "aggregateId", "aggregateVersion", "correlationId", "causationId", "traceId", "payload"],
  "properties": {
    "eventId": {"type": "string", "format": "uuid"},
    "eventType": {"type": "string", "const": "EmailSuppressed"},
    "schemaVersion": {"type": "integer", "const": 1},
    "occurredAt": {"type": "string", "format": "date-time"},
    "producer": {"type": "string", "const": "user-service"},
    "aggregateType": {"type": "string", "const": "DeliverySuppression"},
    "aggregateId": {"type": "string", "pattern": "[A-Za-z0-9._:-]{1,128}", "maxLength": 128},
    "aggregateVersion": {"type": "integer", "minimum": 1},
    "correlationId": {"type": "string", "maxLength": 128},
    "causationId": {"type": ["string", "null"], "maxLength": 128},
    "traceId": {"type": "string", "pattern": "[A-Za-z0-9._:-]{1,128}", "maxLength": 128},
    "payload": {
      "type": "object",
      "additionalProperties": false,
      "required": ["suppressionId", "userId", "reason"],
      "properties": {
        "suppressionId": {"type": "string", "format": "uuid"},
        "userId": {"type": "string", "pattern": "[A-Za-z0-9._:-]{1,128}"},
        "reason": {"type": "string", "enum": ["BOUNCE", "COMPLAINT", "CONSENT_REVOKED", "ADDRESS_CHANGED"]}
      }
    }
  }
}
